{
  "schema_version": "simulation-task-plan.v1",
  "request_id": "ai-memory-badge-v1-rev-a-module",
  "project_id": "ai-memory-badge-v1",
  "project_name": "ai_memory_badge_v1",
  "topology": "ai_memory_badge_v1",
  "source_plan": {
    "schema_version": "simulation-plan.v1",
    "request_id": "ai-memory-badge-v1-rev-a-module"
  },
  "tasks": [
    {
      "task_id": "ai-memory-badge-v1-rev-a-module:power-startup",
      "scenario_id": "power-startup",
      "title": "Power startup check",
      "backend": "ngspice",
      "analysis_kind": "tran",
      "command": [
        "ngspice",
        "-b",
        "D:\\GitRepository\\AI\\KiCadAgentSuite\\examples\\ai-memory-badge-v1\\output\\ngspice-tasks\\power-startup\\netlist.cir",
        "-o",
        "D:\\GitRepository\\AI\\KiCadAgentSuite\\examples\\ai-memory-badge-v1\\output\\ngspice-tasks\\power-startup\\ngspice.log"
      ],
      "netlist_path": "D:\\GitRepository\\AI\\KiCadAgentSuite\\examples\\ai-memory-badge-v1\\output\\ngspice-tasks\\power-startup\\netlist.cir",
      "log_path": "D:\\GitRepository\\AI\\KiCadAgentSuite\\examples\\ai-memory-badge-v1\\output\\ngspice-tasks\\power-startup\\ngspice.log",
      "execution_file": "D:\\GitRepository\\AI\\KiCadAgentSuite\\examples\\ai-memory-badge-v1\\output\\ngspice-tasks\\power-startup\\ngspice-execution.json",
      "feedback_file": "D:\\GitRepository\\AI\\KiCadAgentSuite\\examples\\ai-memory-badge-v1\\output\\ngspice-tasks\\power-startup\\ngspice-feedback.json",
      "focus_components": [],
      "focus_nets": [
        "USB_5V",
        "SYS_3V3",
        "SYS_3V3_REG",
        "MIC_3V3",
        "SD_3V3",
        "EPD_3V3"
      ],
      "stimuli": [
        "Input supply sweep",
        "Load step"
      ],
      "success_criteria": [
        "Primary rail reaches nominal voltage.",
        "Startup does not overshoot excessively.",
        "Output remains stable under a modest load step."
      ],
      "notes": [
        "Prefer a vendor model when the regulator is a switching IC."
      ],
      "status": "pending"
    },
    {
      "task_id": "ai-memory-badge-v1-rev-a-module:usb-input-protection",
      "scenario_id": "usb-input-protection",
      "title": "USB input protection check",
      "backend": "ngspice",
      "analysis_kind": "op",
      "command": [
        "ngspice",
        "-b",
        "D:\\GitRepository\\AI\\KiCadAgentSuite\\examples\\ai-memory-badge-v1\\output\\ngspice-tasks\\usb-input-protection\\netlist.cir",
        "-o",
        "D:\\GitRepository\\AI\\KiCadAgentSuite\\examples\\ai-memory-badge-v1\\output\\ngspice-tasks\\usb-input-protection\\ngspice.log"
      ],
      "netlist_path": "D:\\GitRepository\\AI\\KiCadAgentSuite\\examples\\ai-memory-badge-v1\\output\\ngspice-tasks\\usb-input-protection\\netlist.cir",
      "log_path": "D:\\GitRepository\\AI\\KiCadAgentSuite\\examples\\ai-memory-badge-v1\\output\\ngspice-tasks\\usb-input-protection\\ngspice.log",
      "execution_file": "D:\\GitRepository\\AI\\KiCadAgentSuite\\examples\\ai-memory-badge-v1\\output\\ngspice-tasks\\usb-input-protection\\ngspice-execution.json",
      "feedback_file": "D:\\GitRepository\\AI\\KiCadAgentSuite\\examples\\ai-memory-badge-v1\\output\\ngspice-tasks\\usb-input-protection\\ngspice-feedback.json",
      "focus_components": [
        "U6"
      ],
      "focus_nets": [],
      "stimuli": [
        "Apply nominal VBUS",
        "Observe clamp and fuse behavior"
      ],
      "success_criteria": [
        "Normal VBUS is not clamped under nominal conditions.",
        "Protection parts do not distort the rail during idle bias."
      ],
      "notes": [
        "Use DC operating point first; transient only if the model supports it."
      ],
      "status": "pending"
    },
    {
      "task_id": "ai-memory-badge-v1-rev-a-module:esp32-startup-and-strap",
      "scenario_id": "esp32-startup-and-strap",
      "title": "ESP32 startup and strap check",
      "backend": "ngspice",
      "analysis_kind": "op",
      "command": [
        "ngspice",
        "-b",
        "D:\\GitRepository\\AI\\KiCadAgentSuite\\examples\\ai-memory-badge-v1\\output\\ngspice-tasks\\esp32-startup-and-strap\\netlist.cir",
        "-o",
        "D:\\GitRepository\\AI\\KiCadAgentSuite\\examples\\ai-memory-badge-v1\\output\\ngspice-tasks\\esp32-startup-and-strap\\ngspice.log"
      ],
      "netlist_path": "D:\\GitRepository\\AI\\KiCadAgentSuite\\examples\\ai-memory-badge-v1\\output\\ngspice-tasks\\esp32-startup-and-strap\\netlist.cir",
      "log_path": "D:\\GitRepository\\AI\\KiCadAgentSuite\\examples\\ai-memory-badge-v1\\output\\ngspice-tasks\\esp32-startup-and-strap\\ngspice.log",
      "execution_file": "D:\\GitRepository\\AI\\KiCadAgentSuite\\examples\\ai-memory-badge-v1\\output\\ngspice-tasks\\esp32-startup-and-strap\\ngspice-execution.json",
      "feedback_file": "D:\\GitRepository\\AI\\KiCadAgentSuite\\examples\\ai-memory-badge-v1\\output\\ngspice-tasks\\esp32-startup-and-strap\\ngspice-feedback.json",
      "focus_components": [],
      "focus_nets": [],
      "stimuli": [
        "Power applied at nominal input",
        "Observe strap sampling window",
        "Check crystal bias and decoupling"
      ],
      "success_criteria": [
        "Reset remains asserted long enough during startup.",
        "Boot strap pins settle to the intended logic state.",
        "Crystal and decoupling nets bias correctly at startup."
      ],
      "notes": [
        "This is a functional check, not a full timing-accuracy proof."
      ],
      "status": "pending"
    },
    {
      "task_id": "ai-memory-badge-v1-rev-a-module:indicator-current",
      "scenario_id": "indicator-current",
      "title": "Indicator current check",
      "backend": "ngspice",
      "analysis_kind": "op",
      "command": [
        "ngspice",
        "-b",
        "D:\\GitRepository\\AI\\KiCadAgentSuite\\examples\\ai-memory-badge-v1\\output\\ngspice-tasks\\indicator-current\\netlist.cir",
        "-o",
        "D:\\GitRepository\\AI\\KiCadAgentSuite\\examples\\ai-memory-badge-v1\\output\\ngspice-tasks\\indicator-current\\ngspice.log"
      ],
      "netlist_path": "D:\\GitRepository\\AI\\KiCadAgentSuite\\examples\\ai-memory-badge-v1\\output\\ngspice-tasks\\indicator-current\\netlist.cir",
      "log_path": "D:\\GitRepository\\AI\\KiCadAgentSuite\\examples\\ai-memory-badge-v1\\output\\ngspice-tasks\\indicator-current\\ngspice.log",
      "execution_file": "D:\\GitRepository\\AI\\KiCadAgentSuite\\examples\\ai-memory-badge-v1\\output\\ngspice-tasks\\indicator-current\\ngspice-execution.json",
      "feedback_file": "D:\\GitRepository\\AI\\KiCadAgentSuite\\examples\\ai-memory-badge-v1\\output\\ngspice-tasks\\indicator-current\\ngspice-feedback.json",
      "focus_components": [
        "R6"
      ],
      "focus_nets": [],
      "stimuli": [
        "DC operating point"
      ],
      "success_criteria": [
        "LED current stays within the target range.",
        "Series resistor dissipation is safe."
      ],
      "notes": [
        "Useful as a quick sanity check for visible indicators."
      ],
      "status": "pending"
    },
    {
      "task_id": "ai-memory-badge-v1-rev-a-module:interface-bias",
      "scenario_id": "interface-bias",
      "title": "Interface bias and coupling check",
      "backend": "ngspice",
      "analysis_kind": "op",
      "command": [
        "ngspice",
        "-b",
        "D:\\GitRepository\\AI\\KiCadAgentSuite\\examples\\ai-memory-badge-v1\\output\\ngspice-tasks\\interface-bias\\netlist.cir",
        "-o",
        "D:\\GitRepository\\AI\\KiCadAgentSuite\\examples\\ai-memory-badge-v1\\output\\ngspice-tasks\\interface-bias\\ngspice.log"
      ],
      "netlist_path": "D:\\GitRepository\\AI\\KiCadAgentSuite\\examples\\ai-memory-badge-v1\\output\\ngspice-tasks\\interface-bias\\netlist.cir",
      "log_path": "D:\\GitRepository\\AI\\KiCadAgentSuite\\examples\\ai-memory-badge-v1\\output\\ngspice-tasks\\interface-bias\\ngspice.log",
      "execution_file": "D:\\GitRepository\\AI\\KiCadAgentSuite\\examples\\ai-memory-badge-v1\\output\\ngspice-tasks\\interface-bias\\ngspice-execution.json",
      "feedback_file": "D:\\GitRepository\\AI\\KiCadAgentSuite\\examples\\ai-memory-badge-v1\\output\\ngspice-tasks\\interface-bias\\ngspice-feedback.json",
      "focus_components": [],
      "focus_nets": [
        "UART0_TX",
        "UART0_RX"
      ],
      "stimuli": [
        "DC operating point"
      ],
      "success_criteria": [
        "Interface bias nets sit at intended levels.",
        "No obvious floating interface supply is detected.",
        "VTREF sensing remains stable across the interface network."
      ],
      "notes": [
        "This is a lightweight pre-check, not a high-frequency RF simulation."
      ],
      "status": "pending"
    }
  ],
  "summary": {
    "task_count": 5,
    "scenario_count": 5,
    "analysis_kinds": [
      "op",
      "tran"
    ],
    "backends": [
      "ngspice"
    ]
  },
  "recommendations": [
    "Execute startup and power-path tasks first.",
    "Use op tasks to validate bias before transient-driven startup checks."
  ]
}
